Company Name,Website,City,Basket Type,Segment,What They Make,Revenue Band,Decision Maker,DM Title,DM Background,C1 Manufacturer Score,C1 Evidence,C2 India Score,C2 Evidence,C3 Differentiation Score,C3 Evidence,C4 Tech DM Score,C4 Evidence,C5 Tailwind Score,C5 Evidence,C6 Growth Score,C6 Evidence,Federer Score,Score Band,Verdict,Verdict Reasoning,Personalization Hook,Overall Notes,Evidence Sources
Bharat Biotech,https://www.bharatbiotech.com,Hyderabad,Basket A,Specialty Biotech,Vaccines & biologics including Covaxin,500-1000Cr,Krishna Ella,CMD,PhD Microbiology IIT Madras,Strong,ISO certified vaccine manufacturing plant Genome Valley,Strong,India-based HQ all manufacturing in Hyderabad,Strong,World-first rotavirus vaccine Rotavac indigenously developed,Strong,Founder PhD scientist leads R&D personally,Strong,WHO prequalification CEPI funding global export tailwind,Strong,New mRNA facility expansion 2024 Genome Valley,28,A-Band,PASS,Founder-led deep biotech with global export credentials and unique pipeline,Your mRNA facility expansion aligns perfectly with our platform - would love to show how we support science-driven scale-ups,Top-tier Hyderabad biotech. Flagship of Indian vaccine industry.,Bharat Biotech website WHO PQ list news articles
Biological E,https://www.biologicale.com,Hyderabad,Basket B,Vaccines & Biologics,Vaccines biologics and biosimilars,300-500Cr,Mahima Datla,MD,MBA Harvard family-owned 3rd gen,Strong,GMP certified biologics manufacturing Hyderabad,Strong,Fully Indian-owned all ops in Hyderabad,Strong,One of few Indian companies with Hep B pentavalent vaccine,Strong,Science-trained management with global partnerships,Strong,GAVI supply deal UNICEF procurement tailwind,Strong,Expanded fill-finish capacity 2023 new product launches,26,A-Band,PASS,Deep moat in global vaccine supply chain with GAVI credentials,Your GAVI partnership and new fill-finish line shows you are scaling - our platform helps ops teams match that pace,Strong family-owned professional management,Biological E website GAVI news LinkedIn
Aurigene Oncology,https://www.aurigene.com,Hyderabad,Basket A,Drug Discovery & Oncology,Small molecule oncology drugs discovery,200-500Cr,Dr. Murali Ramachandra,CEO,PhD Chemistry IISc,Strong,Dedicated discovery and synthesis labs Hyderabad,Strong,India HQ all R&D in Hyderabad,Strong,Proprietary oncology pipeline out-licensing to global pharma,Strong,Founder-level scientist leads discovery,Strong,Global oncology drug market tailwind partnered with AstraZeneca,Strong,New partnership deals 2023 pipeline expansion,25,A-Band,PASS,Rare Indian drug discovery company with global big pharma partnerships,Your AstraZeneca collaboration puts you in rare company - we work with similar science-first orgs,Discovery-stage biotech high value target,Aurigene website AstraZeneca press release LinkedIn
Sai Life Sciences,https://www.sailife.com,Hyderabad,Basket A,CDMO & Custom Synthesis,Drug discovery and development CRO/CDMO,500-1000Cr,Krishna Kanumuri,CEO,MBA IIM Ahmedabad + pharma background,Strong,Multi-site manufacturing Hyderabad and Bidar GMP compliant,Strong,India-based all manufacturing ops Hyderabad,Strong,Integrated CRO-to-CDMO model rare in India,Strong,Professional CEO with deep pharma operations background,Strong,Global pharma outsourcing tailwind post-China+1 shift,Strong,TPG private equity investment 2022 major capacity expansion,26,A-Band,PASS,Integrated CDMO with PE backing and aggressive capacity addition,Your TPG-backed expansion into integrated CDMO is a bold move - our tools support fast-scaling ops teams,PE-backed but professional management strong growth signals,Sai Life Sciences website TPG press release LinkedIn
Divi's Laboratories,https://www.divislabs.com,Hyderabad,Basket A,API Manufacturing,APIs and nutraceutical ingredients,5000Cr+,Kiran Divi,MD,BE Chemical Engg family-owned,Strong,Multiple API manufacturing plants Hyderabad Vishakhapatnam,Strong,Fully Indian-owned flagship Hyderabad company,Strong,Global #1 in several API molecules including Naproxen Dextromethorphan,Strong,Family owner with strong chemistry background runs operations,Strong,China+1 API sourcing shift massive tailwind for Indian API makers,Moderate,Established but steady growth brownfield expansion ongoing,22,B-Band,PASS,Dominant API manufacturer with unassailable molecule-level market share,Your position as global leader in Naproxen is rare - we work with companies defending such moats,Large company but founder-led fits well,Divi's annual report NSE filing news
MTAR Technologies,https://mtar.in,Hyderabad,Basket C,Precision Engineering,Precision components for nuclear space defence,300-500Cr,Parvat Srinivas Reddy,CMD,Engineering background founder-led,Strong,Precision machining facility Hyderabad ISO AS9100 certified,Strong,India-based all manufacturing Hyderabad,Strong,Only private Indian company supplying to ISRO nuclear and DRDO,Strong,Founder-engineer personally oversees quality,Strong,Space privatisation Make in India defence tailwind,Strong,Listed NSE 2021 new ISRO orders 2023-24,27,A-Band,PASS,Irreplaceable supplier to India's strategic sectors ISRO DRDO nuclear,Your ISRO and nuclear supply credentials are irreplaceable - curious how you manage such precision at scale,Rare precision engineering company in strategic sectors,MTAR website NSE filings ISRO press releases
Astra Microwave Products,https://www.astramwp.com,Hyderabad,Basket C,Defence Electronics,Microwave and RF sub-systems for defence,300-500Cr,B. Malla Reddy,CMD,Electronics engineering background,Strong,RF microwave manufacturing facility Hyderabad DRDO approved,Strong,India-based all ops Hyderabad,Strong,Specialised RF/microwave supplier very few Indian private competitors,Strong,Technical founder directly involved in product decisions,Strong,Atmanirbhar Bharat defence electronics massive tailwind,Strong,New defence orders 2023 radar system contracts,25,A-Band,PASS,Niche defence electronics supplier with deep DRDO and Navy credentials,Your RF subsystems for Navy radars put you in a category of one - we love working with such focused companies,Listed company strong defence order book,Astra Microwave website NSE annual report
Cyient DLM,https://www.cyientdlm.com,Hyderabad,Basket C,Electronics Manufacturing,Defence and aerospace electronics manufacturing,500-1000Cr,Karthikeyan Natarajan,MD & CEO,Engineering MBA background,Strong,EMS facility Hyderabad AS9100 certified,Strong,India-based listed company Hyderabad,Strong,Integrated design-to-manufacture model for defence aerospace,Strong,Professional CEO with engineering pedigree,Strong,Defence electronics offset policy Make in India tailwind,Strong,Listed 2023 new defence and aerospace wins,24,B-Band,PASS,Design-led EMS company with rare defence certifications and listed pedigree,Your design-to-manufacture model for defence is rare in Indian EMS - would love to discuss how you manage it,Recently listed high growth defence EMS,Cyient DLM website NSE filings
Ananth Technologies,https://www.ananthtech.com,Hyderabad,Basket C,Aerospace Electronics,Avionics and satellite electronics,200-500Cr,Dr. Subba Rao,Founder CMD,PhD Aerospace Engineering,Strong,Avionics manufacturing facility Hyderabad ISRO approved vendor,Strong,India-based all manufacturing Hyderabad,Strong,Private Indian company building satellite subsystems for ISRO,Strong,Founder PhD aerospace engineer rare profile,Strong,Space sector privatisation IN-SPACe tailwind,Strong,Multiple new ISRO satellite contracts 2023-24,26,A-Band,PASS,Founder PhD scientist building satellite systems very rare Indian private company,Your work building satellite subsystems as a private company is historic - we want to understand how you operate,One of India's most credible private space companies,Ananth Technologies website ISRO press releases news
Skyroot Aerospace,https://www.skyroot.in,Hyderabad,Basket C,Space Launch,Private rocket launch company Vikram rocket,100-200Cr,Pawan Kumar Chandana,CEO,IIT Kharagpur aerospace engineer,Strong,Rocket assembly and testing facility Hyderabad,Strong,India-based all R&D and manufacturing Hyderabad,Strong,First Indian private company to launch orbital rocket,Strong,IIT engineer founder hands-on technical leader,Strong,IN-SPACe private space launch tailwind massive,Strong,Successfully launched Vikram-S 2022 preparing orbital launch 2024,28,A-Band,PASS,Historic first mover in Indian private launch market with orbital capability,You made history with Vikram-S - as you scale toward orbital we'd love to support your systems,Highest growth potential in Hyderabad ecosystem,Skyroot website IN-SPACe news TechCrunch coverage
HBL Power Systems,https://www.hbl.in,Hyderabad,Basket C,Industrial Electronics,Batteries and power electronics for defence railways,300-500Cr,Ajay Bhardwaj,MD,Engineering background professional,Strong,Battery and electronics manufacturing Hyderabad DRDO approved,Strong,India-based all manufacturing Hyderabad,Strong,Specialised defence-grade batteries very niche,Strong,Professional management with deep industry knowledge,Strong,Defence electrification railway modernisation tailwind,Strong,New defence battery orders 2023 railway expansion,23,B-Band,PASS,Niche defence battery manufacturer with railway + defence dual revenue streams,Your defence battery credentials for submarines and railways are rare - would love to understand your QA process,Steady growth listed company,HBL website NSE filings defence news
Pennar Industries,https://www.pennarindia.com,Hyderabad,Basket C,Precision Engineering,Precision tubes profiles for aerospace railways,500-1000Cr,Aditya Rao,CEO,Engineering MBA background,Strong,Precision engineering plants Hyderabad Chennai ISO certified,Strong,India HQ all manufacturing India,Strong,Specialised precision tubes for aerospace and railways,Strong,Professional CEO with strong ops background,Strong,Aerospace railway infrastructure boom tailwind,Strong,New aerospace supply contracts 2023 capacity expansion,22,B-Band,PASS,Precision manufacturer with aerospace and railway exposure good growth,Your aerospace-grade precision tubes for ISRO supply chain is a strong differentiator,Listed steady manufacturer,Pennar website NSE filings
VEM Technologies,https://vemtechnologies.com,Hyderabad,Basket C,Defence Manufacturing,Radar and electronic warfare systems,200-300Cr,Veera Reddy,Founder,Engineering background,Strong,Defence electronics manufacturing facility Hyderabad DRDO approved,Strong,India-based all ops Hyderabad,Strong,Radar and EW systems for Indian Army Navy,Strong,Founder-engineer involved in product design,Strong,Atmanirbhar defence electronics tailwind,Strong,New DRDO contracts 2023-24 capacity ramp,24,B-Band,PASS,Founder-led radar and EW company with strong defence credentials,Your radar and EW work for Indian Army is exactly the kind of strategic tech we love to work with,Strong defence focus founder-led,VEM website DRDO news
ECIL,https://www.ecil.co.in,Hyderabad,Basket C,Electronics,Strategic electronics for nuclear space defence,1000Cr+,S.K. Bhatt,CMD,Engineering IAS background,Moderate,Electronics manufacturing Hyderabad government owned,Strong,India-based all manufacturing Hyderabad,Strong,Only Indian company making EVMs election systems nuclear systems,Strong,Govt CMD typically bureaucratic background,Moderate,Govt strategic electronics tailwind,Strong,Steady government orders,18,C-Band,CONDITIONAL,Government PSU lacks agility but strategic moat exists,Your EVM and nuclear electronics work is truly unique - would be curious about your R&D roadmap,PSU may not be best fit but unique moat,ECIL website govt press releases
Premier Explosives,https://www.pelgel.com,Hyderabad,Basket C,Defence Explosives,Propellants and explosives for defence,200-300Cr,T.V. Chowdary,CMD,Chemical engineering background,Strong,Explosives manufacturing near Hyderabad DRDO approved,Strong,India-based all ops near Hyderabad,Strong,One of very few private licensed explosives makers in India,Strong,Technical founder with chemistry background,Strong,Atmanirbhar defence ammunition tailwind,Strong,New DRDO propellant orders 2023,24,B-Band,PASS,Rare private explosives manufacturer with DRDO approval unique moat,Your position as one of very few licensed private explosives makers is truly rare - strategic moat,Rare niche player strong defence tailwind,Premier Explosives website NSE filings
Granules India,https://granulesindia.com,Hyderabad,Basket B,API Pharma,Paracetamol and other bulk APIs,1000-2000Cr,Krishna Prasad Chigurupati,CMD,MBA family-owned,Strong,API and formulations manufacturing Hyderabad Virginia USA,Strong,India HQ founder family,Strong,One of world's largest Paracetamol API producers,Strong,Founder-family active in operations,Strong,China+1 API sourcing tailwind,Moderate,Steady growth some margin pressure,20,C-Band,CONDITIONAL,Strong API manufacturer but commodity-ish product limited differentiation,Your position in Paracetamol API is globally significant - curious if you are moving into specialty APIs,Large commodity API some fit,Granules website NSE filings
Natco Pharma,https://www.natcopharma.co.in,Hyderabad,Basket B,Specialty Pharma,Generic oncology and specialty APIs,1000-2000Cr,Rajeev Nannapaneni,MD,MBA family-owned second gen,Strong,Pharma manufacturing Hyderabad Dehradun US plants,Strong,India HQ founder family,Strong,First-to-file US generics oncology focus,Moderate,Second-gen MD with professional approach,Strong,Global oncology generics tailwind,Moderate,Steady growth,20,C-Band,CONDITIONAL,Specialty pharma with oncology focus decent differentiation but large,Your first-to-file oncology strategy shows real thinking - curious about your API backwards integration,Large company partial fit,Natco website NSE filings
Dr. Reddy's Laboratories,https://www.drreddys.com,Hyderabad,Basket B,Pharma,Generics APIs biosimilars,20000Cr+,Erez Israeli,CEO,Professional external CEO,Moderate,Multiple plants globally HQ Hyderabad,Strong,India HQ,Moderate,Largest Indian pharma global presence biosimilars pipeline,Moderate,Professional external CEO less founder-driven,Moderate,Global generics biosimilars tailwind,Moderate,Steady large company,16,D-Band,REJECT,Too large PE-influenced external CEO not a Federer company,Too large and institutionalised for our typical engagement,Large MNC-style company not ideal fit,Dr Reddys annual report NSE
Hetero Drugs,https://heteroworld.com,Hyderabad,Basket B,Generic Pharma,Generics APIs antiretrovirals,1000-2000Cr,Vamsikrishna Bandi,CMD,Pharma background family-owned,Moderate,API pharma manufacturing Hyderabad multiple plants,Strong,India HQ family-owned,Moderate,Large generic pharma commodity focus,Moderate,Family CMD pharma background,Moderate,Generics market tailwind moderate,Moderate,Moderate growth,17,D-Band,REJECT,Generic commodity pharma too large not differentiated enough,Too generic and commodity-focused for our platform,Large commodity pharma,Hetero website news
SMS Pharmaceuticals,https://smspharma.com,Hyderabad,Basket B,API Manufacturing,APIs for generic pharma,200-300Cr,B. Murali Krishna,CMD,Chemistry background founder,Strong,API manufacturing plants Hyderabad ISO GMP certified,Strong,India-based all ops Hyderabad,Strong,Specialty API supplier with niche molecules,Strong,Founder-chemist runs operations,Strong,China+1 API tailwind,Strong,Capacity expansion 2023 new molecules added,23,B-Band,PASS,Founder-led specialty API maker with niche molecules and expansion mode,Your niche API portfolio away from commodity molecules is smart differentiation - curious about your discovery pipeline,Mid-size strong fit,SMS Pharma website news
Aizant Drug Research Solutions,https://www.aizant.com,Hyderabad,Basket A,CRO/CDMO,Bioavailability and drug formulation research,50-100Cr,Srinivasa Rao Bandari,Founder CEO,Pharma R&D background,Strong,CRO lab facility Hyderabad GLP certified,Strong,India-based all ops Hyderabad,Moderate,Specialised BA/BE and formulation CRO,Strong,Founder scientist runs day to day,Strong,Global CRO outsourcing post-COVID tailwind,Strong,New client acquisitions 2023 capacity expansion,22,B-Band,PASS,Founder-scientist CRO with specialised formulation capabilities,Your specialisation in BA/BE research is a high-value niche - how are you expanding your CDMO capabilities?,Growing CRO niche fits well,Aizant website LinkedIn
Vimta Labs,https://www.vimta.com,Hyderabad,Basket A,Testing & CRO,Analytical testing clinical trials,100-200Cr,Harita Vasireddi,MD,Science background family,Strong,Testing and CRO labs Hyderabad,Strong,India-based all ops Hyderabad,Strong,One of India's oldest NABL accredited pharma testing labs,Strong,Professional family management science background,Strong,Pharma testing regulatory tailwind,Strong,New lab capacity 2022-23 new service lines,23,B-Band,PASS,Trusted pharma testing CRO with decades of regulatory credibility,Your 30-year track record in pharma testing is rare - how are you integrating digital tools into your lab workflows?,Established testing lab strong,Vimta website NABL certificate news
Laurus Labs,https://www.lauruslabs.com,Hyderabad,Basket B,API & CDMO,ARV and oncology APIs CDMO services,2000-5000Cr,Satyanarayana Chava,Founder MD,PhD Chemistry,Strong,API CDMO manufacturing plants Hyderabad Vishakhapatnam,Strong,India HQ founder-led,Strong,Massive ARV API global supplier now pivoting to CDMO synthesis,Strong,Founder PhD scientist rare at this scale,Strong,Global ARV supply CDMO outsourcing tailwind,Strong,Aggressive CDMO capacity addition 2022-24,25,A-Band,PASS,Founder-scientist running large pharma company pivoting to high-value CDMO,Your CDMO pivot from commodity ARV is exactly the kind of strategic ambition we love supporting,Large but founder-led strong fit,Laurus website NSE filings news
Suven Pharmaceuticals,https://www.suven.com,Hyderabad,Basket A,CDMO,CDMO services for innovator pharma,500-1000Cr,Venkateswarlu Jasti,Founder CMD,Chemistry PhD background,Strong,CDMO manufacturing Hyderabad GMP certified,Strong,India HQ founder,Strong,Pure-play innovator CDMO rare model in India,Strong,Founder chemist actively involved,Strong,Global CDMO outsourcing China+1 tailwind,Strong,Demerged and focused CDMO pure play 2021,26,A-Band,PASS,Rare pure-play innovator CDMO with founder-scientist at helm,Your pivot to pure-play innovator CDMO is bold and rare - would love to explore how you manage client complexity,Clean focused CDMO strong fit,Suven website NSE filings
Aptus Value Housing Finance,https://www.aptusindia.com,Hyderabad,Basket D,Financial Services,Housing finance,1000Cr+,M. Anandan,Founder MD,Banker founder,Weak,Financial services not a manufacturer,Strong,India-based,Weak,Housing finance not relevant segment,Weak,Finance not tech manufacturing,Moderate,Housing finance tailwind,Moderate,Good growth,10,D-Band,REJECT,Financial services company not a manufacturer does not fit criteria,Not a manufacturing company - outside our ICP,Not relevant for this assignment,Aptus website
Cyient Ltd,https://www.cyient.com,Hyderabad,Basket D,IT Engineering Services,Engineering services software,2000Cr+,Krishna Bodanapu,MD CEO,Engineering MBA IIT,Weak,IT services company not manufacturer,Moderate,India HQ,Weak,IT services not differentiated manufacturing,Weak,IT services CEO,Moderate,Digital engineering tailwind,Moderate,Steady IT growth,10,D-Band,REJECT,IT services company not a manufacturer outside ICP,IT services don't fit our manufacturing ICP,IT company not relevant,Cyient website
Tata Advanced Systems,https://www.tataadvancedsystems.com,Hyderabad,Basket C,Aerospace Defence,Aerospace structures and defence systems,500-1000Cr,Sukaran Singh,MD CEO,Professional manager Tata group,Moderate,Manufacturing facility Hyderabad Nagpur aerospace structures,Strong,India-based Tata group,Strong,Tata group aerospace defence integration,Moderate,Professional Tata manager not founder,Moderate,Defence aerospace Make in India tailwind,Strong,New Boeing Airbus supply contracts 2023,20,C-Band,CONDITIONAL,Tata group company strong aerospace credentials but professional manager not founder,Your Airbus and Boeing supply work from India is landmark - how independent is the Hyderabad team?,Tata subsidiary partial fit,TASL website Tata news
BDR Pharmaceuticals,https://www.bdrpharma.com,Hyderabad,Basket B,Specialty Pharma,Oncology injectables specialty formulations,200-300Cr,Dhaval Shah,CMD,Pharma background founder,Strong,Pharma manufacturing plant near Hyderabad,Strong,India HQ founder,Strong,Oncology injectable specialist niche,Strong,Founder pharma background,Strong,Oncology injectables high growth tailwind,Strong,New oncology plant expansion 2023,24,B-Band,PASS,Founder-led oncology injectable specialist growing aggressively,Your focus on oncology injectables in a sea of generic tablets is smart - how are you expanding your pipeline?,Niche oncology pharma good fit,BDR Pharma website news
Sutures India,https://www.suturesindia.com,Hyderabad,Basket A,Medical Devices,Surgical sutures and wound care products,100-200Cr,N.V. Ramana,Founder,Medical device background,Strong,Medical device manufacturing Hyderabad ISO CE certified,Strong,India-based all ops,Strong,Specialty surgical sutures with global export,Strong,Founder-led device company,Strong,Medical device Make in India PLI tailwind,Strong,New export contracts 2023 capacity expansion,24,B-Band,PASS,Founder-led medical device maker with global export credentials,Your surgical sutures reaching global hospitals from Hyderabad is a strong story - how is PLI supporting your expansion?,Medical devices good niche,Sutures India website
Innova Captab,https://www.innovacaptab.com,Hyderabad,Basket B,Contract Pharma,Contract manufacturing tablets capsules,200-300Cr,Vinay Loona,Founder CMD,Pharma manufacturing background,Strong,CDMO pharma plant Hyderabad GMP,Strong,India HQ founder,Strong,Specialised CDMO for domestic and export pharma,Strong,Founder with manufacturing expertise,Moderate,Domestic pharma outsourcing tailwind,Strong,New capacity expansion 2023 new client wins,22,B-Band,PASS,Founder-led pharma CDMO with capacity expansion,Your focus on CDMO for regulated markets is smart - are you targeting any US/EU clients?,Pharma CDMO decent fit,Innova Captab website
Vijaya Diagnostic Centre,https://www.vijayadiagnostic.com,Hyderabad,Basket D,Diagnostics,Diagnostic imaging and lab services,200-300Cr,S. Surendranath Reddy,Founder,Radiology background,Weak,Healthcare services not manufacturer,Strong,India HQ Hyderabad,Weak,Services not manufacturing,Weak,Medical services background,Moderate,Healthcare diagnostics tailwind,Moderate,Moderate growth listed 2021,10,D-Band,REJECT,Diagnostics service company not a manufacturer outside ICP,Healthcare services not a manufacturer - outside ICP,Not relevant,Vijaya Diagnostic website
Tresara Health,https://www.tresarahealth.com,Hyderabad,Basket A,Specialty Pharma,Oncology drugs and biosimilars,100-200Cr,Srikant Sreenivas,CEO,Pharma background,Strong,Specialty pharma manufacturing Hyderabad,Strong,India-based,Strong,Oncology and biosimilar focus niche,Strong,Professional CEO pharma background,Strong,Biosimilar oncology global tailwind,Strong,New biosimilar launches 2023,23,B-Band,PASS,Growing oncology biosimilar company with strong pipeline,Your biosimilar oncology pipeline is entering a massive global market - curious about your CMO partnerships,Oncology biosimilar niche,Tresara website news
Bhagyanagar Gas,https://www.bgl.co.in,Hyderabad,Basket D,Gas Distribution,City gas distribution,500-1000Cr,Ravi Shankar,MD,Engineering background,Weak,Gas distribution utility not manufacturer,Strong,India HQ,Weak,Utility service not manufacturing,Weak,Utility manager,Moderate,Natural gas infra tailwind,Moderate,Moderate growth,10,D-Band,REJECT,Utility company not a manufacturer outside ICP,Gas distribution utility - not relevant to ICP,Not relevant,BGL website
Innovative Tech Pack,https://www.itpack.in,Hyderabad,Basket B,Packaging,Specialty pharma packaging solutions,50-100Cr,Rajesh Poddar,Founder,Packaging industry background,Strong,Pharma packaging manufacturing Hyderabad,Strong,India-based,Strong,Specialty pharma compliant packaging,Strong,Founder packaging expert,Strong,Pharma packaging PLI tailwind,Strong,New clients and capacity 2023,21,B-Band,PASS,Specialty pharma packaging founder-led with pharma compliance expertise,Your compliant pharma packaging is a growing niche - how are you handling US FDA packaging requirements?,Pharma packaging niche decent,ITPack website
Megaflex Plastics,https://www.megaflexplastics.com,Hyderabad,Basket B,Packaging,Flexible packaging for pharma FMCG,50-100Cr,Harish Gupta,Founder,Packaging manufacturing background,Strong,Flexible packaging plant Hyderabad,Strong,India-based,Moderate,Specialty flexible packaging limited moat,Moderate,Founder packaging background,Moderate,Flexible packaging growth tailwind moderate,Moderate,Moderate growth,17,C-Band,CONDITIONAL,Flexible packaging decent but limited differentiation,Your pharma-grade flexible packaging has some moat - would need to see what differentiates you from competition,Moderate fit limited differentiation,Megaflex website
Shalina Healthcare,https://www.shalinarealty.com,Hyderabad,Basket D,Real Estate,Real estate development,1000Cr+,Rajesh Agarwal,CMD,Real estate background,Weak,Real estate not manufacturer,Moderate,India HQ,Weak,Real estate not relevant,Weak,Real estate developer,Weak,Real estate market tailwind,Moderate,Moderate growth,8,D-Band,REJECT,Real estate company completely outside ICP,Not a manufacturer - completely outside our ICP,Completely irrelevant,Website
